{"territorio":{"nivel":"municipio","cve":65,"cveEntidad":8,"nombre":"Urique","nombreEntidad":"Chihuahua"},"fuente":"Conteos censales INE (DECEYEC)","suprimido":false,"elecciones":[{"anio":2009,"tipo":"intermedia","participacion":0.257,"lista_nominal":12492,"por_edad":{},"por_sexo":{}},{"anio":2012,"tipo":"presidencial","participacion":0.463,"lista_nominal":10423,"por_edad":{},"por_sexo":{}},{"anio":2015,"tipo":"intermedia","participacion":0.263,"lista_nominal":13061,"por_edad":{},"por_sexo":{}},{"anio":2018,"tipo":"presidencial","participacion":0.657,"lista_nominal":13326,"por_edad":{},"por_sexo":{}},{"anio":2021,"tipo":"intermedia","participacion":0.606,"lista_nominal":13777,"por_edad":{},"por_sexo":{}},{"anio":2024,"tipo":"presidencial","participacion":0.621,"lista_nominal":14047,"por_edad":{},"por_sexo":{}}],"cvegeo":"08065","vecinos":[8,9,27,30,41],"arquetipo":{"id":"A2","nombre":"En ascenso","nivel":-6.72,"efecto_presidencial":6.8,"tendencia":18.88,"volatilidad":9.24,"tipicidad":0.39,"rasgo":"tend"}}