{"territorio":{"nivel":"municipio","cve":17,"cveEntidad":12,"nombre":"Cocula","nombreEntidad":"Guerrero"},"fuente":"Conteos censales INE (DECEYEC)","suprimido":false,"elecciones":[{"anio":2009,"tipo":"intermedia","participacion":0.276,"lista_nominal":12305,"por_edad":{},"por_sexo":{}},{"anio":2012,"tipo":"presidencial","participacion":0.599,"lista_nominal":8416,"por_edad":{},"por_sexo":{}},{"anio":2015,"tipo":"intermedia","participacion":0.603,"lista_nominal":11266,"por_edad":{},"por_sexo":{}},{"anio":2018,"tipo":"presidencial","participacion":0.637,"lista_nominal":11599,"por_edad":{},"por_sexo":{}},{"anio":2021,"tipo":"intermedia","participacion":0.646,"lista_nominal":12013,"por_edad":{},"por_sexo":{}},{"anio":2024,"tipo":"presidencial","participacion":0.628,"lista_nominal":12482,"por_edad":{},"por_sexo":{}}],"cvegeo":"12017","vecinos":[26,30,36,59,60],"arquetipo":{"id":"A3","nombre":"Montaña rusa","nivel":1.97,"efecto_presidencial":-2.42,"tendencia":14.36,"volatilidad":9.9,"tipicidad":0.47,"rasgo":"tend"}}