{"territorio":{"nivel":"municipio","cve":205,"cveEntidad":20,"nombre":"San Juan Lajarcia","nombreEntidad":"Oaxaca"},"fuente":"Conteos censales INE (DECEYEC)","suprimido":false,"elecciones":[{"anio":2009,"tipo":"intermedia","participacion":0.578,"lista_nominal":612,"por_edad":{},"por_sexo":{}},{"anio":2012,"tipo":"presidencial","participacion":0.59,"lista_nominal":585,"por_edad":{},"por_sexo":{}},{"anio":2015,"tipo":"intermedia","participacion":0.423,"lista_nominal":546,"por_edad":{},"por_sexo":{}},{"anio":2018,"tipo":"presidencial","participacion":0.545,"lista_nominal":508,"por_edad":{},"por_sexo":{}},{"anio":2021,"tipo":"intermedia","participacion":0.526,"lista_nominal":517,"por_edad":{},"por_sexo":{}},{"anio":2024,"tipo":"presidencial","participacion":0.565,"lista_nominal":517,"por_edad":{},"por_sexo":{}}],"cvegeo":"20204","vecinos":[64,122,357],"arquetipo":{"id":"A5","nombre":"Bajando el ritmo","nivel":-0.72,"efecto_presidencial":-7.97,"tendencia":-5.46,"volatilidad":7.14,"tipicidad":0.59,"rasgo":"tend"}}