{"territorio":{"nivel":"municipio","cve":12,"cveEntidad":15,"nombre":"Atizapán","nombreEntidad":"México"},"fuente":"Conteos censales INE (DECEYEC)","suprimido":false,"elecciones":[{"anio":2009,"tipo":"intermedia","participacion":0.62,"lista_nominal":6299,"por_edad":{},"por_sexo":{}},{"anio":2012,"tipo":"presidencial","participacion":0.733,"lista_nominal":6803,"por_edad":{},"por_sexo":{}},{"anio":2015,"tipo":"intermedia","participacion":0.63,"lista_nominal":7460,"por_edad":{},"por_sexo":{}},{"anio":2018,"tipo":"presidencial","participacion":0.723,"lista_nominal":8343,"por_edad":{},"por_sexo":{}},{"anio":2021,"tipo":"intermedia","participacion":0.637,"lista_nominal":8944,"por_edad":{},"por_sexo":{}},{"anio":2024,"tipo":"presidencial","participacion":0.68,"lista_nominal":9823,"por_edad":{},"por_sexo":{}}],"cvegeo":"15012","vecinos":[6,74,102],"arquetipo":{"id":"A1","nombre":"Siempre presente","nivel":12.54,"efecto_presidencial":-5.42,"tendencia":-3.74,"volatilidad":1.01,"tipicidad":0.44,"rasgo":"vol"}}