{"territorio":{"nivel":"municipio","cve":3,"cveEntidad":20,"nombre":"Ánimas Trujano","nombreEntidad":"Oaxaca"},"fuente":"Conteos censales INE (DECEYEC)","suprimido":false,"elecciones":[{"anio":2009,"tipo":"intermedia","participacion":0.387,"lista_nominal":2473,"por_edad":{},"por_sexo":{}},{"anio":2012,"tipo":"presidencial","participacion":0.649,"lista_nominal":2664,"por_edad":{},"por_sexo":{}},{"anio":2015,"tipo":"intermedia","participacion":0.324,"lista_nominal":2868,"por_edad":{},"por_sexo":{}},{"anio":2018,"tipo":"presidencial","participacion":0.666,"lista_nominal":3101,"por_edad":{},"por_sexo":{}},{"anio":2021,"tipo":"intermedia","participacion":0.467,"lista_nominal":3325,"por_edad":{},"por_sexo":{}},{"anio":2024,"tipo":"presidencial","participacion":0.593,"lista_nominal":3584,"por_edad":{},"por_sexo":{}}],"cvegeo":"20174","vecinos":[80,386,408],"arquetipo":{"id":"A4","nombre":"De elección grande","nivel":-3.08,"efecto_presidencial":10.64,"tendencia":-1.24,"volatilidad":4.79,"tipicidad":0.45,"rasgo":"efp"}}