{"territorio":{"nivel":"municipio","cve":131,"cveEntidad":20,"nombre":"San Felipe Jalapa de Díaz","nombreEntidad":"Oaxaca"},"fuente":"Conteos censales INE (DECEYEC)","suprimido":false,"elecciones":[{"anio":2009,"tipo":"intermedia","participacion":0.59,"lista_nominal":15358,"por_edad":{},"por_sexo":{}},{"anio":2012,"tipo":"presidencial","participacion":0.768,"lista_nominal":16555,"por_edad":{},"por_sexo":{}},{"anio":2015,"tipo":"intermedia","participacion":0.732,"lista_nominal":17499,"por_edad":{},"por_sexo":{}},{"anio":2018,"tipo":"presidencial","participacion":0.849,"lista_nominal":19015,"por_edad":{},"por_sexo":{}},{"anio":2021,"tipo":"intermedia","participacion":0.837,"lista_nominal":20056,"por_edad":{},"por_sexo":{}},{"anio":2024,"tipo":"presidencial","participacion":0.833,"lista_nominal":20981,"por_edad":{},"por_sexo":{}}],"cvegeo":"20134","vecinos":[95,115,170,232,276,307,328],"arquetipo":{"id":"A1","nombre":"Siempre presente","nivel":22.3,"efecto_presidencial":-4.03,"tendencia":10.77,"volatilidad":3.07,"tipicidad":0.36,"rasgo":"nivel"}}