{"territorio":{"nivel":"municipio","cve":103,"cveEntidad":30,"nombre":"Martínez de la Torre","nombreEntidad":"Veracruz de Ignacio de la Llave"},"fuente":"Conteos censales INE (DECEYEC)","suprimido":false,"elecciones":[{"anio":2009,"tipo":"intermedia","participacion":0.4,"lista_nominal":71413,"por_edad":{},"por_sexo":{}},{"anio":2012,"tipo":"presidencial","participacion":0.6,"lista_nominal":72271,"por_edad":{},"por_sexo":{}},{"anio":2015,"tipo":"intermedia","participacion":0.444,"lista_nominal":74637,"por_edad":{},"por_sexo":{}},{"anio":2018,"tipo":"presidencial","participacion":0.598,"lista_nominal":77921,"por_edad":{},"por_sexo":{}},{"anio":2021,"tipo":"intermedia","participacion":0.485,"lista_nominal":80653,"por_edad":{},"por_sexo":{}},{"anio":2024,"tipo":"presidencial","participacion":0.525,"lista_nominal":83259,"por_edad":{},"por_sexo":{}}],"cvegeo":"30102","vecinos":[24,110,125,158,182,211],"arquetipo":{"id":"A4","nombre":"De elección grande","nivel":-3.65,"efecto_presidencial":-0.56,"tendencia":-1.8,"volatilidad":1.99,"tipicidad":0.54,"rasgo":"vol"}}