{"territorio":{"nivel":"municipio","cve":11,"cveEntidad":32,"nombre":"Trinidad García de la Cadena","nombreEntidad":"Zacatecas"},"fuente":"Conteos censales INE (DECEYEC)","suprimido":false,"elecciones":[{"anio":2009,"tipo":"intermedia","participacion":0.432,"lista_nominal":3048,"por_edad":{},"por_sexo":{}},{"anio":2012,"tipo":"presidencial","participacion":0.54,"lista_nominal":2807,"por_edad":{},"por_sexo":{}},{"anio":2015,"tipo":"intermedia","participacion":0.437,"lista_nominal":2730,"por_edad":{},"por_sexo":{}},{"anio":2018,"tipo":"presidencial","participacion":0.603,"lista_nominal":2821,"por_edad":{},"por_sexo":{}},{"anio":2021,"tipo":"intermedia","participacion":0.59,"lista_nominal":2910,"por_edad":{},"por_sexo":{}},{"anio":2024,"tipo":"presidencial","participacion":0.581,"lista_nominal":3154,"por_edad":{},"por_sexo":{}}],"cvegeo":"32011","vecinos":[28,47],"arquetipo":{"id":"A4","nombre":"De elección grande","nivel":-1.46,"efecto_presidencial":-4.88,"tendencia":6.03,"volatilidad":3.37,"tipicidad":0.43,"rasgo":"vol"}}