{"territorio":{"nivel":"municipio","cve":118,"cveEntidad":7,"nombre":"Santiago el Pinar","nombreEntidad":"Chiapas"},"fuente":"Conteos censales INE (DECEYEC)","suprimido":false,"elecciones":[{"anio":2009,"tipo":"intermedia","participacion":0.75,"lista_nominal":1690,"por_edad":{},"por_sexo":{}},{"anio":2012,"tipo":"presidencial","participacion":0.816,"lista_nominal":1853,"por_edad":{},"por_sexo":{}},{"anio":2015,"tipo":"intermedia","participacion":0.564,"lista_nominal":2088,"por_edad":{},"por_sexo":{}},{"anio":2018,"tipo":"presidencial","participacion":0.643,"lista_nominal":2340,"por_edad":{},"por_sexo":{}},{"anio":2021,"tipo":"intermedia","participacion":0.869,"lista_nominal":2673,"por_edad":{},"por_sexo":{}},{"anio":2024,"tipo":"presidencial","participacion":0.845,"lista_nominal":2985,"por_edad":{},"por_sexo":{}}],"cvegeo":"07119","vecinos":[49,112],"arquetipo":{"id":"A3","nombre":"Montaña rusa","nivel":20.27,"efecto_presidencial":-9.71,"tendencia":3.95,"volatilidad":14.69,"tipicidad":0.35,"rasgo":"vol"}}