{"territorio":{"nivel":"municipio","cve":127,"cveEntidad":30,"nombre":"Paso de Ovejas","nombreEntidad":"Veracruz de Ignacio de la Llave"},"fuente":"Conteos censales INE (DECEYEC)","suprimido":false,"elecciones":[{"anio":2009,"tipo":"intermedia","participacion":0.472,"lista_nominal":23409,"por_edad":{},"por_sexo":{}},{"anio":2012,"tipo":"presidencial","participacion":0.653,"lista_nominal":24262,"por_edad":{},"por_sexo":{}},{"anio":2015,"tipo":"intermedia","participacion":0.459,"lista_nominal":24573,"por_edad":{},"por_sexo":{}},{"anio":2018,"tipo":"presidencial","participacion":0.61,"lista_nominal":24755,"por_edad":{},"por_sexo":{}},{"anio":2021,"tipo":"intermedia","participacion":0.598,"lista_nominal":24921,"por_edad":{},"por_sexo":{}},{"anio":2024,"tipo":"presidencial","participacion":0.547,"lista_nominal":24938,"por_edad":{},"por_sexo":{}}],"cvegeo":"30126","vecinos":[17,45,101,134,149,192],"arquetipo":{"id":"A5","nombre":"Bajando el ritmo","nivel":1.13,"efecto_presidencial":-4.35,"tendencia":-1.39,"volatilidad":4.93,"tipicidad":0.63,"rasgo":"tend"}}